|index|sentID|caseNumber|sentenceNumber|paragraphNumber|isFirst|isLast|rhetClass|text
966|966|1400029P132S1|1400029|1|132|True|False|LegalRuleSentence|With regard to lay evidence, the Board notes that lay persons are not categorically incompetent to speak on matters of medical diagnosis or etiology.
967|967|1400029P132S2|1400029|2|132|False|False|CitationSentence|Davidson v. Shinseki, 581 F.3d 1313, 1316 (Fed. Cir. 2009).
968|968|1400029P132S3|1400029|3|132|False|False|LegalRuleSentence|The Board must consider the type of condition specifically claimed and whether it is readily amenable to lay diagnosis or probative comment on etiology.
969|969|1400029P132S4|1400029|4|132|False|False|CitationSentence|See Woehlaert v. Nicholson, 21 Vet. App. 456, 462 (2007).
970|970|1400029P132S5|1400029|5|132|False|False|ReasoningSentence|In this vein, the Board acknowledges the Veteran is competent to report psychiatric symptoms both during and after service.
971|971|1400029P132S6|1400029|6|132|False|False|CitationSentence|See 38 C.F.R. § 3.159(a)(2); Jandreau, 492 F.3d at 1377 (discussing that Veteran is competent to report a contemporaneous medical diagnosis); Buchanan v. Nicholson, 451 F.3d 1331, 1337 (Fed. Cir. 2006) (discussing general competency of a Veteran to report psychiatric symptoms).
972|972|1400029P132S7|1400029|7|132|False|False|ReasoningSentence|That notwithstanding, in the instant case, the Board has found the Veteran's lay statements are less persuasive than the post-service medical evidence finding that the Veteran does not meet the DSM-IV criteria for PTSD.
973|973|1400029P132S8|1400029|8|132|False|False|LegalRuleSentence|The Federal Circuit has held that the Board can favor competent medical evidence over lay statements offered by the Veteran, as long as the Board neither deems lay evidence categorically incompetent nor improperly requires a medical opinion as the sole way to prove causation.
974|974|1400029P132S9|1400029|9|132|False|False|CitationSentence|King v. Shinseki, 700 F.3d 1339, 1344 (2012).
975|975|1400029P132S10|1400029|10|132|False|False|LegalRuleSentence|Moreover, although the Veteran is competent to describe his psychiatric symptoms, by regulation, PTSD is a condition that can only be diagnosed by a medical professional, according to 38 C.F.R. § 3.304(f).
976|976|1400029P133S1|1400029|1|133|True|False|FindingSentence|Although the Veteran is entitled to the benefit of the doubt where the evidence is in approximate balance, the benefit of the doubt doctrine is inapplicable where, as here, the preponderance of the evidence is service connection for PTSD.
977|977|1400029P133S1|1400029|1|133|True|False|CitationSentence|38 U.S.C.A. § 5107; Gilbert v. Derwinski, 1 Vet. App. 49, 53 (1990).
978|978|1413417P1S1|1413417|1|1|True|False|Sentence|Citation Nr: 1413417
979|979|1413417P63S1|1413417|1|63|True|False|Sentence|FINDINGS OF FACT
980|980|1413417P66S1|1413417|1|66|True|False|FindingSentence|3. The appellant has not been diagnosed with PTSD, and an acquired psychiatric disorder other than PTSD has not been shown to have begun during service, been aggravated by service, or have otherwise resulted from the appellant's military service.
981|981|1413417P107S1|1413417|1|107|True|False|Sentence|REASONS AND BASES FOR FINDINGS AND CONCLUSIONS
982|982|1413417P144S1|1413417|1|144|True|False|Sentence|Acquired psychiatric disorder, to include PTSD
983|983|1413417P145S1|1413417|1|145|True|False|LegalRuleSentence|The Board notes that when a claimant makes a claim, he is seeking service connection for symptoms regardless of how those symptoms are diagnosed or labeled.
984|984|1413417P145S2|1413417|2|145|False|False|LegalRuleSentence|As such, the Board has recharacterized the issue of entitlement to service connection for PTSD as entitlement to service connection for an acquired psychiatric disorder, to include PTSD.
985|985|1413417P145S3|1413417|3|145|False|False|CitationSentence|See Clemons v. Shinseki, 23 Vet. App. 1 (2009).
986|986|1413417P146S1|1413417|1|146|True|False|ReasoningSentence|While the appellant has filed a claim seeking PTSD, and has submitted a number of documents describing the military's efforts to address psychiatric combat trauma, the appellant has not actually presented any evidence to show that he has actually been diagnosed with PTSD, or even if he has, that it is in anyway related to his military service.
987|987|1413417P147S1|1413417|1|147|True|False|EvidenceSentence|The appellant in several of his lengthy statements has suggested that several training exercises for ROTC were stressful, or that he was treated unfairly during service.
988|988|1413417P147S2|1413417|2|147|False|False|EvidenceSentence|He also states studying combat tactics in ROTC classes and participating in training exercises was the same as stressors veterans in combat experience.
989|989|1413417P147S3|1413417|3|147|False|False|ReasoningSentence|Even if such incidents were stressful to him, a diagnosis of PTSD would need to be based upon such an incident.
990|990|1413417P147S4|1413417|4|147|False|False|EvidenceSentence|Here, no such diagnosis is present.
991|991|1413417P147S5|1413417|5|147|False|False|EvidenceSentence|Of note, a number of psychiatric treatment records have been obtained, including from the appellant's psychiatric hospitalization in December 1990 and January 1991, but the records simply do not show that PTSD was ever diagnosed.
992|992|1413417P148S1|1413417|1|148|True|False|ReasoningSentence|To the extent the appellant believes that he has PTSD from service, he lacks the medical training and expertise to address a complex medical question such as diagnosing a specific psychiatric disability.
993|993|1413417P148S2|1413417|2|148|False|False|CitationSentence|See Jandreau v. Nicholson, 492 F. 3d 1372 (Fed. Cir. 2007).
994|994|1413417P148S3|1413417|3|148|False|False|FindingSentence|Accordingly, the appellant's claim for PTSD is therefore denied.
995|995|1413417P149S1|1413417|1|149|True|False|EvidenceSentence|Turning to the issue of an acquired psychiatric disorder, other than PTSD, it was noted in several service treatment records that the appellant had a history of psychiatric treatment which predated service.
996|996|1413417P149S2|1413417|2|149|False|False|ReasoningSentence|The appellant has requested that the Board obtain records from this psychiatric treatment at Bayberry Hospital, but the Board concludes that such records could not serve to benefit the appellant.
997|997|1413417P149S3|1413417|3|149|False|False|CitationSentence|See Sabonis v. Brown, 6 Vet. App. 426, 430 (1994) (remands which would only result in unnecessarily imposing additional burdens on VA with no benefit flowing to the veteran are to be avoided).
998|998|1413417P150S1|1413417|1|150|True|False|EvidenceSentence|The appellant was found to be psychiatrically normal at his physical examination just prior to his ROTC summer camp.
999|999|1413417P150S2|1413417|2|150|False|False|LegalRuleSentence|However, the presumption of soundness does not apply to active duty for training or inactive duty for training.
1000|1000|1413417P150S3|1413417|3|150|False|False|CitationSentence|See Smith v. Shinseki, 24 Vet. App. 40 (2010).
1001|1001|1413417P150S4|1413417|4|150|False|False|EvidenceSentence|Regardless, even if the appellant was treated prior to his ROTC summer camp, the fact remains that there is no record of any psychiatric manifestations during the 1969 summer camp.
1002|1002|1413417P151S1|1413417|1|151|True|False|LegalRuleSentence|A previous psychiatric hospitalization might be relevant to the extent that the appellant's period of service from September to December 1970 was active duty, and he would therefore be entitled to the presumption of soundness based on the normal psychiatric profile on his physical examination in October 1970.
1003|1003|1413417P151S2|1413417|2|151|False|False|CitationSentence|38 U.S.C.A. § 1111.
1004|1004|1413417P151S3|1413417|3|151|False|False|LegalRuleSentence|However, the fact that the appellant was treated for depression prior to service would be relevant only if VA needed to rebut the presumption of soundness.
1005|1005|1413417P151S4|1413417|4|151|False|False|LegalRuleSentence|This is not required here, as the presumption of soundness applies only when there is manifestation of a disease or injury during service.
1006|1006|1413417P151S5|1413417|5|151|False|False|CitationSentence|See Gilbert v. Shinseki, 26 Vet. App. 48 (2012).
1007|1007|1413417P152S1|1413417|1|152|True|False|EvidenceSentence|In this case, the appellant was repeatedly found to be psychiatrically normal on the physical examinations during his active duty service.
1008|1008|1413417P152S2|1413417|2|152|False|False|EvidenceSentence|It is true that he reported having experienced nervousness or depression on several medical history surveys, but such notations were clarified by the medical officer to be referring to his hospitalization during college (that is prior to his active service).
1009|1009|1413417P152S3|1413417|3|152|False|False|EvidenceSentence|A September 1970 document indicates the hospitalization had occurred three years earlier, again, prior to active duty for training in 1969, and involved a situational depression following his father's death.
1010|1010|1413417P152S4|1413417|4|152|False|False|EvidenceSentence|The in-service examinations found the appellant to be psychiatrically normal, and the psychiatric evaluation in September 1970 found he was fit for duty, with no residual psychiatric defects.
1011|1011|1413417P152S5|1413417|5|152|False|False|FindingSentence|As such, there simply is no in-service manifestation of any psychiatric problem.
1012|1012|1413417P152S6|1413417|6|152|False|False|Sentence|Thus, without any in-service psychiatric manifestation, the presumption of soundness does not apply.
1013|1013|1413417P152S7|1413417|7|152|False|False|CitationSentence|See Gilbert, supra.
1014|1014|1413417P153S1|1413417|1|153|True|False|EvidenceSentence|Following service, the appellant has been treated for several psychiatric problems.
1015|1015|1413417P153S2|1413417|2|153|False|False|FindingSentence|However, no psychiatric disability has been shown to have begun during, been aggravated by, or have otherwise been caused by the appellant's brief military service.
1016|1016|1413417P153S3|1413417|3|153|False|False|ReasoningSentence|To this end, the appellant has not specifically identified any medical professional who has made such a connection; and the appellant lacks the training and experience to render such a nexus opinion himself.
1017|1017|1413417P153S4|1413417|4|153|False|False|CitationSentence|See Jandreau v. Nicholson, 492 F. 3d 1372 (Fed. Cir. 2007).
1018|1018|1413417P154S1|1413417|1|154|True|False|ReasoningSentence|Moreover, the medical evidence of record suggests other causes for the appellant's current psychiatric impairment.
1019|1019|1413417P154S2|1413417|2|154|False|False|EvidenceSentence|In October 2010, the appellant underwent a psychological evaluation at which he reported feeling somewhat depressed and frustrated, asserting that he no longer enjoyed activities that he had previously.
1020|1020|1413417P154S3|1413417|3|154|False|False|EvidenceSentence|The appellant was then hospitalized for two weeks in December 1990 and January 1991 for worsening depression and suicidal ideation.
1021|1021|1413417P154S4|1413417|4|154|False|False|EvidenceSentence|The discharge summary noted that the appellant had been experiencing increased pain secondary to a motor vehicle accident in 1988.
1022|1022|1413417P154S5|1413417|5|154|False|False|EvidenceSentence|It was noted that he had been treated in the 60s and 70s for depression and had received some outpatient treatment from 1974-76 following a 1973 motor vehicle accident.
1023|1023|1413417P154S6|1413417|6|154|False|False|EvidenceSentence|He was diagnosed with depression, chronic pain, and question of organic mood disorder secondary to brain injury.
1024|1024|1413417P154S7|1413417|7|154|False|False|EvidenceSentence|However, there was no mention of the appellant's military service.
1025|1025|1413417P154S8|1413417|8|154|False|False|ReasoningSentence|Thus, these records suggest a cause for the appellant's psychiatric impairment that is not related to his military service.
1026|1026|1413417P155S1|1413417|1|155|True|False|EvidenceSentence|In March 1991, a LCSW (Kurgans) noted that neuropsychological testing supported a finding that the appellant had a brain injury that in all likelihood occurred when he had his accident in April 1988.
1027|1027|1413417P155S2|1413417|2|155|False|False|EvidenceSentence|In December 1995, she again noted that the appellant had experienced chronic pain since a motor vehicle accident in 1988, and she suggested that this accident had led to diagnosis of major depressive disorder, and organic brain syndrome.
1028|1028|1413417P155S3|1413417|3|155|False|False|EvidenceSentence|She noted that the appellant had been seen for psychotherapy since 1990.
1029|1029|1413417P156S1|1413417|1|156|True|False|EvidenceSentence|The appellant reported to her that he saw parallels between his military and post-military governmental experiences in that in both situations he did not receive sufficient support for his injuries.
1030|1030|1413417P156S2|1413417|2|156|False|False|Sentence|The appellant has asserted on several occasions that insufficient consideration was given to this statement.
1031|1031|1413417P156S3|1413417|3|156|False|False|ReasoningSentence|However, what the appellant appears to be missing is that the LCSW was merely recording his contentions without lending them any medical endorsement; and, as discussed, the service treatment records do not support a finding of any psychiatric impairment during service.
1032|1032|1413417P156S4|1413417|4|156|False|False|ReasoningSentence|As such, while this report was considered, it does not suggest that a psychiatric disability is the result of the appellant's active duty or his active duty for training.
1033|1033|1413417P157S1|1413417|1|157|True|False|EvidenceSentence|The appellant's mother wrote in February 2002 that the appellant had gone to Virginia State College and then served in the U.S. Army.
1034|1034|1413417P157S2|1413417|2|157|False|False|EvidenceSentence|She asserted that he seemed to have problems dealing with stress since having gone into the service.
1035|1035|1413417P157S3|1413417|3|157|False|False|ReasoningSentence|However, this statement does not specifically show the onset of psychiatric symptoms while the appellant was on active duty for training or active duty, or suggest that such service caused an acquired psychiatric disorder to develop.
1036|1036|1413417P158S1|1413417|1|158|True|False|ReasoningSentence|Moreover, like the appellant, his mother may be confused about what constitutes service.
1037|1037|1413417P158S2|1413417|2|158|False|False|ReasoningSentence|"It is quite understandable that a lay person might perceive either ROTC participation or inactive service while in the Army reserves (as the appellant had from January 1970 until he was separated from the reserves in April 1974) as constituting ""military service."""
1038|1038|1413417P158S3|1413417|3|158|False|False|ReasoningSentence|However, as explained above, neither constitutes military service for the purpose of service connection.
1039|1039|1413417P158S4|1413417|4|158|False|False|EvidenceSentence|Here, the appellant was clearly hospitalized in college while in the ROTC.
1040|1040|1413417P158S4|1413417|4|158|False|False|EvidenceSentence|Likewise, the appellant may have experienced some psychiatric problems while still in the reserves in the wake of his motor vehicle accident in 1971 which caused significant physical limitation.
1041|1041|1413417P158S5|1413417|5|158|False|False|ReasoningSentence|However, he was not on either active duty or active duty for training at either time, and therefore any psychiatric manifestations during those times would not warrant service connection.
1042|1042|1413417P159S1|1413417|1|159|True|False|FindingSentence|As described, to the extent that the appellant currently has an acquired psychiatric disorder, it is not shown that such a condition either began during or was otherwise caused by his military service, or was in any way aggravated by such service.
1043|1043|1413417P159S2|1413417|2|159|False|False|FindingSentence|Rather, the appellant is frequently shown to have psychiatric problems as a result of post-service injuries.
1044|1044|1413417P159S3|1413417|3|159|False|False|FindingSentence|Thus, the criteria for service connection have not been met, and the appellant's claim is denied.
1045|1045|1431031P1S1|1431031|1|1|True|False|Sentence|Citation Nr: 1431031
1046|1046|1431031P15S1|1431031|1|15|True|False|Sentence|FINDINGS OF FACT
1047|1047|1431031P17S1|1431031|1|17|True|False|FindingSentence|2. The evidence does not show an in-service incurrence of mental health problems.
1048|1048|1431031P21S1|1431031|1|21|True|False|Sentence|REASONS AND BASES FOR FINDINGS AND CONCLUSIONS
1049|1049|1431031P49S1|1431031|1|49|True|False|Sentence|Psychiatric Disability
1050|1050|1431031P50S1|1431031|1|50|True|False|FindingSentence|The criteria for service connection for an acquired psychiatric disability have not been met.
1051|1051|1431031P50S2|1431031|2|50|False|False|CitationSentence|See 38 C.F.R. § 3.303.
1052|1052|1431031P51S1|1431031|1|51|True|False|FindingSentence|The Veteran has current mental health diagnoses and treatment.
1053|1053|1431031P51S2|1431031|2|51|False|False|EvidenceSentence|VA treatment from 2013 shows diagnoses of bipolar disability, PTSD, and polysubstance abuse.
1054|1054|1431031P51S3|1431031|3|51|False|False|EvidenceSentence|Dr. AMS diagnosed mood disability in May 2012.
1055|1055|1431031P52S1|1431031|1|52|True|False|FindingSentence|The evidence does not show an in-service incurrence of mental health problems.
1056|1056|1431031P52S2|1431031|2|52|False|False|EvidenceSentence|Service treatment records from February 1974 note psychiatric problems prior to entering service.
1057|1057|1431031P52S3|1431031|3|52|False|False|EvidenceSentence|The Veteran was given a mental health evaluation prior to acceptance for service.
1058|1058|1431031P52S4|1431031|4|52|False|False|EvidenceSentence|A pre-service history was noted, but no current neurosis or psychosis was found.
1059|1059|1431031P52S5|1431031|5|52|False|False|EvidenceSentence|Despite the noted history, the Veteran was found fit for duty without any psychiatric disability at the time of entrance into service.
1060|1060|1431031P52S6|1431031|6|52|False|False|ReasoningSentence|Thus, the presumption of soundness could be for application in this claim as well.
1061|1061|1431031P52S7|1431031|7|52|False|False|CitationSentence|38 C.F.R. § 3.304(b).
1062|1062|1431031P52S8|1431031|8|52|False|False|LegalRuleSentence|However, before the presumption of soundness is for application, there must be evidence that a disease or injury that was not noted upon entry to service manifested or was incurred in service.
1063|1063|1431031P52S9|1431031|9|52|False|False|CitationSentence|See Gilbert v. Shinseki, 26 Vet. App. 48, 52 (2012).
1064|1064|1431031P52S10|1431031|10|52|False|False|EvidenceSentence|There is no evidence in the Veteran's service records of any treatment or complaints of mental health problems.
1065|1065|1431031P52S11|1431031|11|52|False|False|EvidenceSentence|The Veteran has also not reported any mental health symptoms during service.
1066|1066|1431031P52S12|1431031|12|52|False|False|FindingSentence|Therefore, the presumption of soundness is not for application and there is no in-service incurrence of mental health problems.
1067|1067|1431031P53S1|1431031|1|53|True|False|LegalRuleSentence|Claims for service connection for PTSD require an in-service incurrence, or stressor, accompanied by credible and supporting evidence that the stressor claimed to be the cause of the disability occurred in service, or specific circumstances of combat or hostile military or terrorist activities consistent with the nature of said service.
1068|1068|1431031P53S2|1431031|2|53|False|False|CitationSentence|38 C.F.R. § 3.304(f); Cohen v. Brown, 10 Vet. App. 128, 138 (1997).
1069|1069|1431031P53S3|1431031|3|53|False|False|EvidenceSentence|In a February 2012 letter, the Joint Services Records Research Center coordinator determined that there was insufficient evidence in the Veteran's claims file to corroborate any stressor associated with a claim for PTSD.
1070|1070|1431031P53S3|1431031|3|53|False|False|EvidenceSentence|The Veteran has not provided a statement of a stressor event of any kind.
1071|1071|1431031P53S4|1431031|4|53|False|False|FindingSentence|Therefore, service connection for PTSD cannot be established.
1072|1072|1431031P53S5|1431031|5|53|False|False|CitationSentence|See 38 C.F.R. § 3.304.
1073|1073|1431031P54S1|1431031|1|54|True|False|LegalRuleSentence|Service connection for substance abuse is prohibited by law.
1074|1074|1431031P54S2|1431031|2|54|False|False|CitationSentence|38 U.S.C.A. § 1110.
1075|1075|1431031P55S1|1431031|1|55|True|False|EvidenceSentence|Private treatment records show treatment for situational depression in 1979 and continuous mental health treatment in the 1990s and 2000s.
1076|1076|1431031P55S2|1431031|2|55|False|False|EvidenceSentence|Additionally, an opinion from Dr. AMS concludes that the Veteran's mental health conditions are aggravated by his back condition.
1077|1077|1431031P55S3|1431031|3|55|False|False|FindingSentence|However, his back condition is not service-connected and cannot provide a basis upon which to grant service connection for his mental health disabilities.
1078|1078|1431031P55S4|1431031|4|55|False|False|FindingSentence|Moreover, with no in-service incurrence of mental health problems, service connection cannot be granted and a discussion of the nexus element is moot.
1079|1079|1431031P55S5|1431031|5|55|False|False|CitationSentence|See 38 C.F.R. § 3.303.
1080|1080|1431031P56S1|1431031|1|56|True|False|FindingSentence|The preponderance of the evidence is against service connection for a low back disability and an acquired psychiatric disability.
1081|1081|1431031P56S2|1431031|2|56|False|False|CitationSentence|See 38 C.F.R. § 3.303.
1082|1082|1431031P56S3|1431031|3|56|False|False|FindingSentence|The benefit of the doubt was given and is otherwise inapplicable.
1083|1083|1431031P56S4|1431031|4|56|False|False|CitationSentence|See 38 C.F.R. § 3.102.
1084|1084|1455333P1S1|1455333|1|1|True|False|Sentence|Citation Nr: 1455333
1085|1085|1455333P22S1|1455333|1|22|True|False|Sentence|FINDING OF FACT
1086|1086|1455333P23S1|1455333|1|23|True|False|FindingSentence|The Veteran has been diagnosed with PTSD medically linked to an established in-service stressor related to engaging in combat with the enemy.
1087|1087|1455333P26S1|1455333|1|26|True|False|Sentence|REASONS AND BASES FOR FINDING AND CONCLUSION
1088|1088|1455333P27S1|1455333|1|27|True|False|EvidenceSentence|The Veteran's claim is based, in part, on his contention that his PTSD resulted from his combat experiences while serving in the Republic of Vietnam.
1089|1089|1455333P27S2|1455333|2|27|False|False|FindingSentence|For the following reasons, the Board finds that service connection for PTSD is established.
1090|1090|1455333P28S1|1455333|1|28|True|False|LegalRuleSentence|Service connection means that a veteran has a current disability resulting from disease or injury incurred in or aggravated by active service.
1091|1091|1455333P28S2|1455333|2|28|False|False|CitationSentence|38 U.S.C.A. §§ 1110, 1131 (West 2002); 38 C.F.R. § 3.303(a).
1092|1092|1455333P28S3|1455333|3|28|False|False|LegalRuleSentence|Service connection may be granted for any disease diagnosed after discharge when the evidence shows that the disease was incurred in service.
1093|1093|1455333P28S4|1455333|4|28|False|False|CitationSentence|38 C.F.R. § 3.303(d).
1094|1094|1455333P29S1|1455333|1|29|True|False|LegalRuleSentence|"Service connection is established when the following elements are satisfied: (1) the existence of a current disability; (2) in-service incurrence or aggravation of a disease or injury; and (3) a causal relationship or ""medical nexus"" between the current disability and the disease or injury incurred or aggravated during service."
1095|1095|1455333P29S2|1455333|2|29|False|False|CitationSentence|Shedden, 381 F.3d at 1166-67; see 38 C.F.R. § 3.303(a).
1096|1096|1455333P30S1|1455333|1|30|True|False|LegalRuleSentence|Specific to claims for PTSD, service connection generally requires medical evidence diagnosing the condition in accordance with the American Psychiatric Association: Diagnostic and Statistical Manual of Mental Disorders (4th ed. 1994) (DSM-IV), a link, established by medical evidence, between the current symptomatology and the claimed in-service stressors, and credible supporting evidence that the claimed in-service stressors actually occurred.
1097|1097|1455333P30S2|1455333|2|30|False|False|CitationSentence|See 38 C.F.R. §§ 3.304(f), 4.125(a).
1098|1098|1455333P30S3|1455333|3|30|False|False|LegalRuleSentence|However, in the specific circumstances enumerated in 38 C.F.R. § 3.304(f), the Veteran's statements alone may be sufficient to establish the in-service stressor.
1099|1099|1455333P31S1|1455333|1|31|True|False|Sentence|The Board has thoroughly reviewed all the evidence in the claims file, and has an obligation to provide an adequate statement of reasons or bases supporting its decision.
1100|1100|1455333P31S2|1455333|2|31|False|False|CitationSentence|See 38 U.S.C.A. § 7104(d)(1) (West 2002); Gonzales v. West, 218 F.3d 1378, 1380-81 (Fed. Cir. 2000).
