|index|sentID|caseNumber|sentenceNumber|paragraphNumber|isFirst|isLast|rhetClass|text
1959|1959|1514581P74S6|1514581|6|74|False|False|EvidenceSentence|The psychiatrist indicated that she was unable to definitely establish a diagnosis of PTSD, though she noted that the Veteran did report symptoms of irritability and nightmares related to early childhood events.
1960|1960|1514581P75S1|1514581|1|75|True|False|EvidenceSentence|When seen by VA in September 2010, the Veteran reported disturbing nightmares, but said that her depressive symptoms had improved significantly since getting in contact with her sister.
1961|1961|1514581P75S2|1514581|2|75|False|False|EvidenceSentence|The Veteran reported nightmares every other night involving a motor vehicle accident and of a friend being decapitated.
1962|1962|1514581P75S3|1514581|3|75|False|False|EvidenceSentence|She talked about her service days, including the time that she took a picture of an airman who had been decapitated.
1963|1963|1514581P75S4|1514581|4|75|False|False|EvidenceSentence|The examiner indicated that the Veteran had a history of questionable sub-syndromal PTSD.
1964|1964|1514581P75S5|1514581|5|75|False|False|EvidenceSentence|The diagnosis was mood disorder, NOS.
1965|1965|1514581P76S1|1514581|1|76|True|False|EvidenceSentence|Pursuant to the Board's May 2013 remand, a VA medical opinion was obtained in June 2013.
1966|1966|1514581P76S2|1514581|2|76|False|False|EvidenceSentence|As noted, the examiner acknowledged that the Veteran's verified in-service stressors could support a diagnosis of PTSD.
1967|1967|1514581P76S3|1514581|3|76|False|False|EvidenceSentence|However, she found that in the case of this particular Veteran, the events she experienced in the military, although upsetting and stressful, did not appear to be medically sufficient to cause all or part of her particular PTSD.
1968|1968|1514581P77S1|1514581|1|77|True|False|ReasoningSentence|This assessment is relatively consistent with the VA treatment records detailed above.
1969|1969|1514581P77S2|1514581|2|77|False|False|EvidenceSentence|The examiner observed that as had been stated by both the Veteran and her treatment providers, the Veteran's PTSD and its expressed symptoms primarily pertained to her severe childhood abuse.
1970|1970|1514581P77S3|1514581|3|77|False|False|EvidenceSentence|Moreover, the examiner found that the content of the Veteran's re-experiencing symptoms was predominately related to childhood traumas, and there were no avoidance or hyperarousal symptoms described in treatment notes or other documentation that would be relatable to these traumatic events in the military.
1971|1971|1514581P77S4|1514581|4|77|False|False|EvidenceSentence|The VA examiner also observed that more recently, the Veteran had discussed the 1997 car accident in which her fiancée died.
1972|1972|1514581P77S5|1514581|5|77|False|False|EvidenceSentence|In recent treatment, she cited this as the most traumatic event she had experienced.
1973|1973|1514581P77S6|1514581|6|77|False|False|EvidenceSentence|She also discontinued treatment because discussing this event was triggering memories and anxiety about childhood abuse.
1974|1974|1514581P78S1|1514581|1|78|True|False|Sentence|In September 2013, the Veteran's representative argued that the VA examiner had erred by stating that the records do not demonstrate a military stressor that would account for the majority of the symptoms presentation, or that this constituted the bulk of treatment focus, in that the examiner appeared to conclude that it was an all or nothing debate.
1975|1975|1514581P78S2|1514581|2|78|False|False|Sentence|"The representative suggested that under the liberal at least as likely as not standard there is no need to demonstrate that a ""bulk"" of the problem or a ""majority"" of the treatment focused only on the service stressors."
1976|1976|1514581P78S3|1514581|3|78|False|False|Sentence|The representative acknowledged that the Veteran had readily stated that her childhood trauma was aggravated by the military stressors.
1977|1977|1514581P78S4|1514581|4|78|False|False|Sentence|Yet, the representative suggested that the VA examiner had failed to discuss the aspect of the conceded trauma dealing with the documentation of child abuse victims during service and whether this one aspect of the military stressor more than any other could have resurfaced the Veteran's childhood traumas-even now hidden amongst the discussion of her own childhood traumas.
1978|1978|1514581P79S1|1514581|1|79|True|False|Sentence|The Board has considered this argument and concurs that an in-service stressor need not be the predominant (that is bulk or majority) cause of PTSD.
1979|1979|1514581P79S2|1514581|2|79|False|False|EvidenceSentence|Although the examiner found that the witnessing of traumatic events, such as the ones photographed by the Veteran during service, would be sufficient to establish Criterion A, the examiner explained that in the Veteran's case, the evidence did not demonstrate that the Veteran met Criterion B (symptoms of reexperiencing) or C and D (symptoms of avoidance and hyperarousal) under the DSM-IV for PTSD as a result of the in-service experiences.
1980|1980|1514581P79S3|1514581|3|79|False|False|EvidenceSentence|The VA examiner explained that the symptoms of reexperiencing, avoidance, and hyperarousal that the Veteran experienced, and which formed the basis of her PTSD diagnosis, were associated with childhood abuse and her fiancée's death in 1997-not with the Veteran's experiences in service.
1981|1981|1514581P79S4|1514581|4|79|False|False|ReasoningSentence|"Moreover, although the representative had suggested that the examiner failed to use the ""at least as likely as not standard,"" the June 2013 VA examination report directly contradicts this assertion as the examiner specifically opined that the Veteran's PTSD was ""less likely than not"" incurred in or caused by the confirmed in-service stressors."
1982|1982|1514581P79S5|1514581|5|79|False|False|ReasoningSentence|The Board finds that June 2013 VA medical opinion to be highly probative on the question of a possible nexus to service.
1983|1983|1514581P80S1|1514581|1|80|True|False|LegalRuleSentence|While the Veteran is competent to provide evidence concerning her observations and experiences, any such assertions must be weighed against other evidence of record, including her inconsistent and contradictory statements.
1984|1984|1514581P80S2|1514581|2|80|False|False|CitationSentence|See Buchanan v. Nicholson, 451 F.3d 1331 (Fed. Cir. 2006).
1985|1985|1514581P80S3|1514581|3|80|False|False|LegalRuleSentence|"""Once evidence is determined to be competent, the Board must determine whether such evidence is also credible."""
1986|1986|1514581P80S4|1514581|4|80|False|False|CitationSentence|Barr v. Nicholson, 21 Vet. App. 303, 308 (2007).
1987|1987|1514581P80S5|1514581|5|80|False|False|LegalRuleSentence|"While competency is a legal determination, credibility ""is a factual determination going to the probative value of the evidence to be made after the evidence has been admitted."""
1988|1988|1514581P80S6|1514581|6|80|False|False|CitationSentence|Layno v. Brown, 6 Vet. App. 465, 469 (1994) (citing Cartright v. Derwinski, 2 Vet. App. 24, 25 (1991)).
1989|1989|1514581P81S1|1514581|1|81|True|False|ReasoningSentence|The Board has also considered the Veteran's statements purporting to relate her currently diagnosed PTSD to her verified in-service stressor event.
1990|1990|1514581P81S2|1514581|2|81|False|False|ReasoningSentence|Upon review of the evidence of record, the Board finds that the Veteran's statements are not credible as they are inconsistent with, and outweighed by, other lay and medical evidence of record.
1991|1991|1514581P81S3|1514581|3|81|False|False|LegalRuleSentence|Credibility can be generally evaluated by a showing of interest, bias or inconsistent statements; and the demeanor of the witness, facial plausibility of the testimony, and the consistency of the witness testimony are also factors that may be considered.
1992|1992|1514581P81S4|1514581|4|81|False|False|CitationSentence|Caluza v. Brown, 7 Vet. App. 498, 510-511 (1995).
1993|1993|1514581P81S5|1514581|5|81|False|False|LegalRuleSentence|The Board emphasizes that the Court has recognized that personal interest to receive benefits may affect the credibility of the evidence.
1994|1994|1514581P81S6|1514581|6|81|False|False|CitationSentence|Cartright, 2 Vet. App. at 25 (1991).
1995|1995|1514581P82S1|1514581|1|82|True|False|ReasoningSentence|In this regard, the Board notes that the Veteran has made numerous inconsistent and contradictory statements regarding the nature, extent, and severity of her psychiatric symptoms during the pendency of this appeal, revising her statements in an attempt to associate her current psychiatric problems to her time in service.
1996|1996|1514581P82S2|1514581|2|82|False|False|EvidenceSentence|For example, at her Board hearing the Veteran testified that she never sought psychiatric counseling in service because she did not think that she had any problems.
1997|1997|1514581P82S3|1514581|3|82|False|False|ReasoningSentence|Yet, in a conflicting statement, she also stated that she did not seek treatment in service because she would have lost her security clearance.
1998|1998|1514581P83S1|1514581|1|83|True|False|EvidenceSentence|She again endorsed first realizing that there was something wrong in approximately 2002.
1999|1999|1514581P83S2|1514581|2|83|False|False|EvidenceSentence|After doing some research, she realized that she had all the symptoms described for PTSD, including hypervigilance and panic attacks.
2000|2000|1514581P83S3|1514581|3|83|False|False|ReasoningSentence|However, after a meticulous review of all of the medical treatment records of record, the Board has not found a single complaint or report of hypervigilance or panic attacks.
2001|2001|1514581P83S4|1514581|4|83|False|False|EvidenceSentence|Moreover, the March 2012 JMR failed to identify any such symptoms.
2002|2002|1514581P84S1|1514581|1|84|True|False|EvidenceSentence|Similarly, while the Veteran testified that she had vivid, recurring nightmares, and flashbacks related specifically to her experiences in service four-to-five times per week, she did not describe any such symptoms related to service when examined by VA in 2007.
2003|2003|1514581P84S2|1514581|2|84|False|False|EvidenceSentence|"Most of the treatment records indicated that she gave a ""vague"" description of her nightmares and flashbacks."
2004|2004|1514581P84S3|1514581|3|84|False|False|EvidenceSentence|On the few occasions when she did describe her nightmares and flashbacks, the Veteran reported that they were about the abuse she suffered and witnessed as a child and the death of her fiancée.
2005|2005|1514581P85S1|1514581|1|85|True|False|EvidenceSentence|Furthermore, although the Veteran was treated for psychiatric problems on numerous occasions since May 2005, as described above, she never mentioned any symptoms or problems related to her service experiences as a photographer until one and a half years later (see November 2006 treatment note), coincident with her September 2006 claim for same.
2006|2006|1514581P85S2|1514581|2|85|False|False|EvidenceSentence|Even during July 2007 treatment, the Veteran did not relate her current psychiatric problems to any incident in service and said only that when she heard a child cry, it reminded her of the child she photographed in service, who had been abused.
2007|2007|1514581P85S3|1514581|3|85|False|False|ReasoningSentence|She consistently reported being physically and emotionally abused as a child and believed that this was part of her PTSD.
2008|2008|1514581P85S4|1514581|4|85|False|False|ReasoningSentence|The fact that the Veteran would recognize that she had PTSD or some symptoms of PTSD in 2002, which she believed to be related to service, but did not report any such symptoms as being related to service until some four years later, and 18 months after documented psychiatric treatment-instead detailing prior and subsequent unrelated stressors-strains credibility.
2009|2009|1514581P85S5|1514581|5|85|False|False|ReasoningSentence|Even looking at the Veteran's efforts at VA examinations, it was noted at the February 2007 VA examination that the Veteran was quick to endorse items, apparently trying to make herself look more disturbed than she was, thereby suggesting a willingness to inaccurately discuss her medical symptomatology.
2010|2010|1514581P86S1|1514581|1|86|True|False|Sentence|The Board now turns to aggravation of PTSD by military stressors.
2011|2011|1514581P86S2|1514581|2|86|False|False|ReasoningSentence|As previously indicated, the February 2007 VA examination resulted in the possibility of aggravation-too equivocal to establish the requisite nexus.
2012|2012|1514581P86S3|1514581|3|86|False|False|Sentence|Nevertheless, because this examination had allowed for the possibility that the Veteran's acquired psychiatric disability had been aggravated by her military service, the Board, as directed by the July 2014 JMR, obtained a medical opinion to investigation the possibility of this association.
2013|2013|1514581P87S1|1514581|1|87|True|False|EvidenceSentence|In November 2014 the same examiner who completed the June 2013 examination addressed the question of whether the Veteran's military experiences aggravated his childhood based PTSD.
2014|2014|1514581P87S2|1514581|2|87|False|False|EvidenceSentence|After fully reviewing the evidence of record, the examiner concluded that an opinion regarding aggravation of PTSD based on the impact of conceded traumas in service could not be rendered without resort to mere speculation.
2015|2015|1514581P87S3|1514581|3|87|False|False|EvidenceSentence|She explained that without documentation of any medical disorder or associated symptoms at any time prior to military service-symptoms which the Veteran herself denied appreciating even through her military service-there is no way to specify if traumatic memories of the military experiences were associated with a permanent worsening of the Veteran's PTSD.
2016|2016|1514581P87S4|1514581|4|87|False|False|EvidenceSentence|The examiner also noted that there was no baseline level of functioning found in the available medical evidence, upon which to base a conclusion that a condition had been aggravated.
2017|2017|1514581P88S1|1514581|1|88|True|False|ReasoningSentence|As explained by the examiner, the record does not provide a basis upon which to render a principled assessment regarding aggravation.
2018|2018|1514581P88S2|1514581|2|88|False|False|ReasoningSentence|A medical opinion cannot be compelled where a health care provider has specifically identified the information necessary to render a clinical determination and has yet deemed the available information insufficient-or entirely absent.
2019|2019|1514581P88S3|1514581|3|88|False|False|ReasoningSentence|Neither the Veteran nor the record identifies or suggests any source of relevant evidence that might aid in a determination.
2020|2020|1514581P88S4|1514581|4|88|False|False|ReasoningSentence|The Board appreciates the complexity of such a determination on the sparsity of the available record and fully credits the VA examiner's explanation.
2021|2021|1514581P88S5|1514581|5|88|False|False|CitationSentence|See Jones v. Shinseki, 23 Vet. App. 382, 391 (2010) (stating a VA medical examination is not inadequate merely because the medical examiner states he or she cannot reach a conclusion without resort to speculation and the duty to assist does not extend to requiring a VA physician to render an opinion beyond what may reasonably be concluded from the procurable medical evidence).
2022|2022|1514581P88S6|1514581|6|88|False|False|ReasoningSentence|As such, the examiner's conclusion is fully adequate and is not rendered inadequate solely on the grounds that the examiner stated that she could not form an opinion without resorting to speculation.
2023|2023|1514581P89S1|1514581|1|89|True|False|ReasoningSentence|For the reasons discussed above, the Board finds that the Veteran's alleged symptoms regarding her service experiences are self-serving and are not credible.
2024|2024|1514581P89S2|1514581|2|89|False|False|ReasoningSentence|Moreover, after taking into account the Veteran's reported history of symptomatology, the June 2013 VA examiner offered a highly probative medical opinion that the Veteran's PTSD was due to her childhood abuse and death of her fiancée.
2025|2025|1514581P89S3|1514581|3|89|False|False|ReasoningSentence|Additionally, while the Veteran was treated by several other psychiatrists over the years, most of those reports indicate that her current psychiatric problems were related to her childhood abuse.
2026|2026|1514581P90S1|1514581|1|90|True|False|FindingSentence|The Board has considered whether the evidence supports a finding that the Veteran's PTSD was aggravated by her in-service experiences, but finds that there is not sufficient evidence to meet the relative equipoise standard.
2027|2027|1514581P90S2|1514581|2|90|False|False|ReasoningSentence|That is, the absence of evidence to the contrary does not render it at least as likely as not that a psychiatric disability was aggravated, particularly when, as here, the is overwhelming evidence that the Veteran's psychiatric disability is attributable to non-service related situations.
2028|2028|1514581P91S1|1514581|1|91|True|False|FindingSentence|In conclusion, the preponderance of evidence establishes that the Veteran was diagnosed with PTSD years after service, based on pre- and post-service stressors, with no manifestation of PTSD during service.
2029|2029|1514581P91S2|1514581|2|91|False|False|ReasoningSentence|Consequently, the burden of proof, by any degree, has not been shifted to VA.
2030|2030|1514581P91S3|1514581|3|91|False|False|ReasoningSentence|Second, while the Veteran's duties as a photographer in service have been found to meet a single criterion for a diagnosis of PTSD, the remaining criteria have not been found by mental health professionals to be so met, in relation specifically to any military stressor.
2031|2031|1514581P91S4|1514581|4|91|False|False|FindingSentence|As such, there is no supported and significantly probative evidence of diagnosed PTSD directly caused by the Veteran's active service.
2032|2032|1514581P91S5|1514581|5|91|False|False|Sentence|Last, pursuant to the July 2014 JMR, VA most recently sought an opinion as to whether military service yet aggravated the Veteran's PTSD, in light of suggested possibility.
2033|2033|1514581P91S6|1514581|6|91|False|False|ReasoningSentence|While the burden of proof remains on the Veteran to at least balance the evidence for and against her claim, the VA examiner's reasoned opinion that the issue of aggravation cannot be resolved without resort to mere speculation provides no weight or counterweight at all, as the absence of evidence does not move the evidentiary scales.
2034|2034|1514581P91S7|1514581|7|91|False|False|FindingSentence|There is no credible and probative medical evidence to establish that military service aggravated PTSD diagnosed fifteen years later.
2035|2035|1514581P92S1|1514581|1|92|True|False|FindingSentence|Based on the evidence of record, both lay and medical, the Board finds that the weight of the evidence is against a finding of relationship between the Veteran's currently diagnosed PTSD and her corroborated in-service stressor events.
2036|2036|1514581P92S2|1514581|2|92|False|False|FindingSentence|Accordingly, the Board finds that a preponderance of the evidence is against the Veteran's claim for service connection for PTSD, and the claim must be denied.
2037|2037|1514581P93S1|1514581|1|93|True|False|Sentence|Other Acquired Psychiatric Disorders
2038|2038|1514581P94S1|1514581|1|94|True|False|FindingSentence|The evidence of record demonstrates that, in addition to PTSD, the Veteran has also been diagnosed with other psychiatric disorders during the pendency of this appeal, to include: major depressive disorder, gender identity disorder, and personality disorder.
2039|2039|1514581P94S2|1514581|2|94|False|False|FindingSentence|However, the totality of the competent medical evidence does not show that these conditions began during or were otherwise caused by the Veteran's military service.
2040|2040|1514581P95S1|1514581|1|95|True|False|FindingSentence|As noted in the previous section, there is no indication that the Veteran had any psychiatric problems either in service or for more than a decade after service.
2041|2041|1514581P95S2|1514581|2|95|False|False|ReasoningSentence|When first seeking treatment in June 2002, tellingly, the Veteran did not relate her depression to service but, instead, stated that it began when she left her wife to be involved in an alternative lifestyle.
2042|2042|1514581P95S3|1514581|3|95|False|False|EvidenceSentence|The Veteran did not follow-up on treatment until May 2005, when she was diagnosed with major depressive disorder and the focus of treatment was primarily related to her ex-wife.
2043|2043|1514581P96S1|1514581|1|96|True|False|EvidenceSentence|Again, the Veteran filed a claim for VA disability benefits in September 2006.
2044|2044|1514581P96S2|1514581|2|96|False|False|EvidenceSentence|In a November 2006 VA outpatient clinic note, the Veteran reported the death of her fiancé in 1997 and mentioned in-service photos of disturbing images.
2045|2045|1514581P96S3|1514581|3|96|False|False|EvidenceSentence|At that time, she was having problems with sleep, concentration, depression, nightmares, and anger, which she was said began at age ten.
2046|2046|1514581P96S4|1514581|4|96|False|False|EvidenceSentence|During private psychiatric assessment in December 2006, the Veteran reported that she had felt depressed since 1986, when she was placed on medical administrative hold pending evaluation of a pre-existing ear disorder.
2047|2047|1514581P96S5|1514581|5|96|False|False|EvidenceSentence|She was diagnosed with major depressive disorder, with no comment regarding origin.
2048|2048|1514581P97S1|1514581|1|97|True|False|EvidenceSentence|At the April 2011 Travel Board hearing, the Veteran submitted a letter from a fellow soldier who recalled a time when the Veteran was sad and distant.
2049|2049|1514581P97S2|1514581|2|97|False|False|EvidenceSentence|However, as noted in the previous section, a psychiatric disorder was not noted at service entrance and service treatment records are negative for any diagnoses or treatment for major depressive disorder.
2050|2050|1514581P97S3|1514581|3|97|False|False|EvidenceSentence|In the Report of Medical History for separation from service in July 1990, the Veteran specifically denied any history of trouble sleeping, depression or excess worry, memory problems or nervous trouble of any sort, and no pertinent psychiatric abnormalities were found on examination at that time.
2051|2051|1514581P97S4|1514581|4|97|False|False|ReasoningSentence|The board finds the contemporaneous record more probative than the statement twenty years later.
2052|2052|1514581P97S5|1514581|5|97|False|False|CitationSentence|See Curry v. Brown, 7 Vet. App. 59, 68 (1994) (noting that contemporaneous evidence has greater probative value than history as reported by a veteran).
2053|2053|1514581P98S1|1514581|1|98|True|False|EvidenceSentence|During January 2007 VA treatment, she reported struggling with her sexual identity since childhood, since seven or eight years old.
2054|2054|1514581P99S1|1514581|1|99|True|False|ReasoningSentence|The Board finds that VA treatment notes of record document an extensive and complex mental health history.
2055|2055|1514581P99S2|1514581|2|99|False|False|EvidenceSentence|However, they do not provide a medical opinion as to the etiology of the Veteran's depression.
2056|2056|1514581P99S3|1514581|3|99|False|False|EvidenceSentence|In efforts to obtain a medical opinion on the question of whether the Veteran's psychiatric disorders were etiologically related to service, the Veteran was afforded a VA examination in February 2007.
2057|2057|1514581P99S4|1514581|4|99|False|False|EvidenceSentence|Upon review of the claims file and mental status examination, the examiner, in pertinent part, diagnosed: gender identity disorder; depressive disorder, not otherwise specified (in full remission); and personality disorder with histrionic and narcissistic traits.
2058|2058|1514581P100S1|1514581|1|100|True|False|EvidenceSentence|The VA examiner opined that none of these psychiatric disorders were related to service.
2059|2059|1514581P100S2|1514581|2|100|False|False|EvidenceSentence|In support of this opinion, the February 2007 VA examiner reasoned that there was no evidence during the examination that the Veteran was suffering from depression.
2060|2060|1514581P100S3|1514581|3|100|False|False|EvidenceSentence|According to the examiner, the suicidal note that the Veteran gave to a counselor in August of 2006 was for attention seeking behavior, as the Veteran had a pattern of behavior that would be inferred as narcissistic and/or histrionic.
2061|2061|1514581P100S4|1514581|4|100|False|False|EvidenceSentence|It was noted that, since her youth, the Veteran seemed to have had a pattern of seeking attention suggesting a character or personality disorder.
2062|2062|1514581P100S5|1514581|5|100|False|False|EvidenceSentence|The examiner further noted that the Veteran also appeared to be troubled about gender issues.
2063|2063|1514581P100S6|1514581|6|100|False|False|ReasoningSentence|The Board finds the February 2007 VA medical opinion, which is uncontroverted in the record, highly probative of the nexus element for service connection of an acquired psychiatric disorder.
