|index|sentID|caseNumber|sentenceNumber|paragraphNumber|isFirst|isLast|rhetClass|text
3062|3062|1554465P52S1|1554465|1|52|True|False|EvidenceSentence|She reported that she had worked regularly for the past 24 years as a support person in a plant.
3063|3063|1554465P52S2|1554465|2|52|False|False|EvidenceSentence|She was no longer able to drive.
3064|3064|1554465P52S3|1554465|3|52|False|False|EvidenceSentence|"She said that she was evaluated by a ""whole lot of different doctors"" in the 1980s when she injured her back at work."
3065|3065|1554465P52S4|1554465|4|52|False|False|EvidenceSentence|She thought she saw a psychiatrist who also did some family counseling back then.
3066|3066|1554465P52S5|1554465|5|52|False|False|EvidenceSentence|She was put on some sort of prescription medication that made her dislike the way she felt and therefore she discontinued it.
3067|3067|1554465P52S6|1554465|6|52|False|False|ReasoningSentence|The Veteran reported a stressor during her reserve service; to that extent, the September 2000 treatment notes are favorable to the claim.
3068|3068|1554465P53S1|1554465|1|53|True|False|EvidenceSentence|An October 2000 VA mental health clinic group intake note indicated no improvement in auditory hallucinations after taking medications.
3069|3069|1554465P53S2|1554465|2|53|False|False|EvidenceSentence|The diagnosis was major depression with psychotic features.
3070|3070|1554465P53S3|1554465|3|53|False|False|EvidenceSentence|An Addendum to the note reflects that the Veteran reported that, while on active duty, she assisted in picking up body parts of 13 Marines who died in a chopper crash.
3071|3071|1554465P53S4|1554465|4|53|False|False|EvidenceSentence|The VA provider suggested that this incident may have had some temporal and causative effects on her psychological problems.
3072|3072|1554465P53S5|1554465|5|53|False|False|ReasoningSentence|To the extent that the provider suggested that a stressor during reserve service might be linked to a current psychiatric disorder, these treatment notes are favorable to the claim.
3073|3073|1554465P53S6|1554465|6|53|False|False|ReasoningSentence|However, in the absence of objective evidence corroborating this stressor, the medical opinion based on the uncorroborated stressor is of little probative value.
3074|3074|1554465P54S1|1554465|1|54|True|False|EvidenceSentence|A December 2000 VA mental health clinic note indicates that the Veteran had continued depressive symptoms, with marked isolation and reduced interest in past friends or hobbies.
3075|3075|1554465P54S2|1554465|2|54|False|False|EvidenceSentence|She related having nightmares with increasing frequency.
3076|3076|1554465P54S3|1554465|3|54|False|False|EvidenceSentence|The nightmares focus on her being ordered around and victimized.
3077|3077|1554465P55S1|1554465|1|55|True|False|EvidenceSentence|A March 2001 mental health psychiatry note indicates that the Veteran's mood and affect continue to slowly brighten.
3078|3078|1554465P55S2|1554465|2|55|False|False|EvidenceSentence|She still had occasional auditory hallucinations and intrusive thoughts of picking up body parts of friends following a helicopter crash in California.
3079|3079|1554465P56S1|1554465|1|56|True|False|EvidenceSentence|In March 2002, the Veteran was hospitalized for severe depression and psychotic features.
3080|3080|1554465P56S2|1554465|2|56|False|False|EvidenceSentence|She reported having auditory hallucinations but was unable to figure out what they were saying.
3081|3081|1554465P56S3|1554465|3|56|False|False|EvidenceSentence|She described having command auditory hallucinations and visual hallucinations regarding people she knew in the Vietnam War.
3082|3082|1554465P57S1|1554465|1|57|True|False|EvidenceSentence|A March 2002 VA psychiatry note indicates that the Veteran described seeing people from the war, friends she knew, soldiers to whom she delivered mail.
3083|3083|1554465P57S2|1554465|2|57|False|False|EvidenceSentence|She discussed nightmares of a woman's finger being severed in service.
3084|3084|1554465P57S3|1554465|3|57|False|False|ReasoningSentence|To the extent that the Veteran reported a stressor during her reserve service, these treatment notes are favorable to the claim.
3085|3085|1554465P58S1|1554465|1|58|True|False|EvidenceSentence|An April 2002 Social Security Administration (SSA) record indicates that, after an honorable discharge from the military she worked at Lockheed Martin processing tools, parts, and blueprints for 25 years, until August 12, 2001.
3086|3086|1554465P58S2|1554465|2|58|False|False|EvidenceSentence|The examiner noted the Veteran's account of some problems with nervousness and depression, and her hospitalization in March 2002.
3087|3087|1554465P58S3|1554465|3|58|False|False|ReasoningSentence|Since this evidence establishes that the Veteran was able to work for the same employer for 25 following her separation from active service, this evidence is unfavorable to a finding that the Veteran manifested behavioral changes following any incident of active or reserve service.
3088|3088|1554465P59S1|1554465|1|59|True|False|EvidenceSentence|An August 2002 VA PTSD outpatient treatment note indicates that the Veteran reported having ongoing dreams about sexual trauma that occurred in the military.
3089|3089|1554465P60S1|1554465|1|60|True|False|EvidenceSentence|A September 2002, the Veteran complained of chronic depression and PTSD.
3090|3090|1554465P60S2|1554465|2|60|False|False|EvidenceSentence|The Veteran reported having had an abusive childhood.
3091|3091|1554465P60S3|1554465|3|60|False|False|EvidenceSentence|She was physically abused by her father and mother.
3092|3092|1554465P60S4|1554465|4|60|False|False|EvidenceSentence|Her father fondled her after the death of her mother.
3093|3093|1554465P60S5|1554465|5|60|False|False|EvidenceSentence|She stated that this was a lone incident and denied any other unwanted childhood sexual experiences.
3094|3094|1554465P60S6|1554465|6|60|False|False|EvidenceSentence|The Veteran reported experiencing sexual trauma in the military.
3095|3095|1554465P60S7|1554465|7|60|False|False|EvidenceSentence|Specifically, she reported being raped by three other women.
3096|3096|1554465P60S8|1554465|8|60|False|False|EvidenceSentence|She reported that she reported this incident to her commanding officer but no action was taken.
3097|3097|1554465P61S1|1554465|1|61|True|False|EvidenceSentence|"She indicated that boot camp was ""fine."""
3098|3098|1554465P61S2|1554465|2|61|False|False|EvidenceSentence|"She stated that she was named ""outstanding recruit of the platoon"" and that she received her first rank out of boot camp."
3099|3099|1554465P61S3|1554465|3|61|False|False|EvidenceSentence|The Veteran reported psychiatric problems since her military discharge.
3100|3100|1554465P61S4|1554465|4|61|False|False|EvidenceSentence|The examiner opined that the Veteran met the criteria for a diagnosis of PTSD due to sexual assault that she suffered while on active duty.
3101|3101|1554465P61S5|1554465|5|61|False|False|EvidenceSentence|The Veteran reported audiovisual hallucinations of her rapists and other Marines.
3102|3102|1554465P61S6|1554465|6|61|False|False|EvidenceSentence|She reacted with intense fear and helplessness.
3103|3103|1554465P61S7|1554465|7|61|False|False|EvidenceSentence|She had nightmares about the rape, reported dissociative states in which she feels as if she is reliving her rape and defending herself.
3104|3104|1554465P61S8|1554465|8|61|False|False|ReasoningSentence|This evidence is favorable to, but not dispositive of, the claim.
3105|3105|1554465P62S1|1554465|1|62|True|False|EvidenceSentence|A September 2002 VA mental health note reflects she had a tenuous living situation.
3106|3106|1554465P62S2|1554465|2|62|False|False|EvidenceSentence|She was unable to pay her rent, utilities, and food.
3107|3107|1554465P62S3|1554465|3|62|False|False|EvidenceSentence|She was noted to be in treatment at the Women's Program for PTSD.
3108|3108|1554465P62S4|1554465|4|62|False|False|EvidenceSentence|The impression was depressive disorder, history of psychosis, stable, inadequate housing and history of PTSD, currently being treated.
3109|3109|1554465P62S5|1554465|5|62|False|False|ReasoningSentence|An October 2002 outpatient report was consistent with the September 2002 report.
3110|3110|1554465P63S1|1554465|1|63|True|False|EvidenceSentence|At VA psychiatric examination in November 2002, the Veteran reported that in May 1969 she was on guard duty in the family barracks at Camp Pendleton when three females attacked her and performed sexual acts.
3111|3111|1554465P63S2|1554465|2|63|False|False|EvidenceSentence|She called for help, but no one came.
3112|3112|1554465P63S3|1554465|3|63|False|False|EvidenceSentence|She wrote a note in the company logbook indicating that an incident had occurred, but she did not give any details.
3113|3113|1554465P63S4|1554465|4|63|False|False|EvidenceSentence|She also reported the incident to her commanding officer and provided the names of the individuals involved.
3114|3114|1554465P63S5|1554465|5|63|False|False|EvidenceSentence|She was not referred to a hospital and did not seek psychiatric help.
3115|3115|1554465P64S1|1554465|1|64|True|False|EvidenceSentence|She also recounted a helicopter crash at Camp Pendleton, during her reserve service, in which one of her roommates was killed.
3116|3116|1554465P64S2|1554465|2|64|False|False|EvidenceSentence|She recalled finding a finger lying near the crash site.
3117|3117|1554465P64S3|1554465|3|64|False|False|EvidenceSentence|Eight Marines were killed.
3118|3118|1554465P65S1|1554465|1|65|True|False|EvidenceSentence|The examiner assigned a diagnosis of major depressive disorder with psychotic features.
3119|3119|1554465P65S2|1554465|2|65|False|False|EvidenceSentence|The examiner noted that, despite the history of mixed depressive and psychotic symptoms dating back 10 to 15 years, the Veteran had held a job successfully until approximately two years earlier.
3120|3120|1554465P65S3|1554465|3|65|False|False|EvidenceSentence|The criteria for diagnosis of schizoaffective disorder was not met, the examiner concluded, because it was not clear that she ever had a distinct period of two weeks when the psychotic symptoms persisted but she was free of mood symptoms.
3121|3121|1554465P65S4|1554465|4|65|False|False|EvidenceSentence|The examiner opined, in essence, that no current psychiatric disorder was linked to the Veteran's service or any incident thereof.
3122|3122|1554465P65S5|1554465|5|65|False|False|ReasoningSentence|The opinion is well reasoned and provides an accurate summary of the record.
3123|3123|1554465P65S6|1554465|6|65|False|False|ReasoningSentence|The opinion is persuasive evidence against the claim.
3124|3124|1554465P66S1|1554465|1|66|True|False|EvidenceSentence|A January 2003 VA PTSD outpatient report noted that the Veteran discussed several motor vehicle accidents in which she was involved.
3125|3125|1554465P66S2|1554465|2|66|False|False|EvidenceSentence|She reported an incident in the military in which she fell from a vehicle and slid 50 feet into an intersection.
3126|3126|1554465P66S3|1554465|3|66|False|False|EvidenceSentence|She stated that anxiety attacks were a barrier to driving.
3127|3127|1554465P66S4|1554465|4|66|False|False|EvidenceSentence|This treatment note provides a description of a stressor not previously reported.
3128|3128|1554465P67S1|1554465|1|67|True|False|EvidenceSentence|However, the Veteran has not provided additional information as to the possible date or location of a motor vehicle accident referenced in the January 2003 treatment notes.
3129|3129|1554465P67S2|1554465|2|67|False|False|EvidenceSentence|She has not indicated when or where she was treated for injuries sustained in such a motor vehicle accident in the 10 years since she mentioned such a stressor.
3130|3130|1554465P67S3|1554465|3|67|False|False|EvidenceSentence|The Veteran has not provided any additional details which could be used to verify the motor vehicle accident.
3131|3131|1554465P67S4|1554465|4|67|False|False|ReasoningSentence|Thus, the treatment note is unfavorable to the claim, since it is not consistent with any prior information and is not clarified or further described in any later stressor account.
3132|3132|1554465P68S1|1554465|1|68|True|False|EvidenceSentence|SSA awarded the Veteran disability benefits in a favorable 2003 decision.
3133|3133|1554465P68S2|1554465|2|68|False|False|EvidenceSentence|The award letter provides no discussion of a specific stressor or a link between the Veteran's service and an acquired psychiatric disability.
3134|3134|1554465P68S3|1554465|3|68|False|False|ReasoningSentence|This award, and the underlying medical evidence, provides no additional information that is favorable or unfavorable to the claim.
3135|3135|1554465P69S1|1554465|1|69|True|False|EvidenceSentence|An April 2003 VA outpatient note indicates that the award of SSA disability benefits reminded the Veteran of past hardships including being raped, homeless, unemployed, and depressed.
3136|3136|1554465P69S2|1554465|2|69|False|False|EvidenceSentence|This event led to a resurgence of memories associated with the rape, including the name of one of her attackers, T., as well as a woman who later helped protect her from the rapists, E.
3137|3137|1554465P69S3|1554465|3|69|False|False|EvidenceSentence|The social worker who authored the note indicated that memories of her rape appeared to have been the core of the Veteran's current dysphoria.
3138|3138|1554465P70S1|1554465|1|70|True|False|ReasoningSentence|This treatment note raises additional inconsistencies in the information provided by the Veteran.
3139|3139|1554465P70S2|1554465|2|70|False|False|EvidenceSentence|Although the Veteran told the provider she remembered names of two servicemembers involved in the incident, the Veteran has never provided any name of a fellow former servicemember for purposes of development of her claim for compensation.
3140|3140|1554465P70S3|1554465|3|70|False|False|ReasoningSentence|Her statements at the April 2003 VA treatment visit are inconsistent with her actions since that time.
3141|3141|1554465P70S4|1554465|4|70|False|False|ReasoningSentence|That inconsistency undermines her credibility.
3142|3142|1554465P71S1|1554465|1|71|True|False|Sentence|The Board has considered all the evidence of record regarding an alleged sexual assault that the Veteran reports occurred during her active service.
3143|3143|1554465P71S2|1554465|2|71|False|False|ReasoningSentence|The fact that no service department records of the incident have been located does not weigh against the possible occurrence or the Veteran's credibility, since VA regulations recognize that such incidents, if reported, were not uniformly documented.
3144|3144|1554465P71S3|1554465|3|71|False|False|EvidenceSentence|However, in the October 2003 stressor statement, the Veteran stated that she could not remember the names of any individuals involved.
3145|3145|1554465P71S4|1554465|4|71|False|False|ReasoningSentence|That report is in conflict with the April 2003 treatment report.
3146|3146|1554465P72S1|1554465|1|72|True|False|EvidenceSentence|The Veteran contends that she had symptoms of a psychiatric disability soon after her discharge from active duty and soon after reserve service was completed.
3147|3147|1554465P72S2|1554465|2|72|False|False|ReasoningSentence|The Veteran is competent to report events during active service.
3148|3148|1554465P72S3|1554465|3|72|False|False|LegalRuleSentence|However, once evidence is determined to be competent, the Board must determine whether such evidence is also credible.
3149|3149|1554465P72S4|1554465|4|72|False|False|CitationSentence|"See Layno v. Brown, 6 Vet. App. 465 (1994) (distinguishing between competency (""a legal concept determining whether testimony may be heard and considered"") and credibility (""a factual determination going to the probative value of the evidence to be made after the evidence has been admitted"")."
3150|3150|1554465P72S5|1554465|5|72|False|False|ReasoningSentence|The evidence of record contradicts the Veteran's assertion of chronic psychiatric symptoms or disability or symptoms or disability due to psychosis during a presumptive period.
3151|3151|1554465P73S1|1554465|1|73|True|False|LegalRuleSentence|In weighing credibility, VA may consider interest, bias, inconsistent statements, bad character, internal inconsistency, facial plausibility, self-interest, consistency with other evidence of record, malingering, desire for monetary gain, and demeanor of the witness.
3152|3152|1554465P73S2|1554465|2|73|False|False|CitationSentence|Caluza v. Brown, 7 Vet. App. 498 (1995).
3153|3153|1554465P73S3|1554465|3|73|False|False|LegalRuleSentence|The Board may weigh the absence of contemporaneous medical evidence against the lay evidence in determining credibility, but the Board cannot determine that lay evidence lacks credibility merely because it is unaccompanied by contemporaneous medical evidence.
3154|3154|1554465P73S4|1554465|4|73|False|False|CitationSentence|Buchanan v. Nicholson, 451 F.3d 1331 (Fed. Cir. 2006).
3155|3155|1554465P74S1|1554465|1|74|True|False|LegalRuleSentence|The Board may not ignore a veteran's testimony simply because he or she is an interested party and stands to gain monetary benefits; personal interest may, however, affect the credibility of the evidence.
3156|3156|1554465P74S2|1554465|2|74|False|False|CitationSentence|Cartright v. Derwinski, 2 Vet. App. 24, 25 (1991).
3157|3157|1554465P74S3|1554465|3|74|False|False|EvidenceSentence|The Veteran provided varying accounts of stressor events to VA adjudicators and treatment providers during the lengthy pendency of the appeal.
3158|3158|1554465P74S4|1554465|4|74|False|False|ReasoningSentence|Given the inconsistencies between the Veteran's reports and the objective evidence of record, the Veteran's credibility is diminished.
3159|3159|1554465P75S1|1554465|1|75|True|False|Sentence|The Veteran's service personnel records are associated with the claims file.
3160|3160|1554465P75S2|1554465|2|75|False|False|EvidenceSentence|Review of the service personnel records shows no indication of disciplinary actions, adverse personnel actions, drop in performance, or requests for reassignment.
3161|3161|1554465P75S3|1554465|3|75|False|False|EvidenceSentence|During active service she states that she was awarded the outstanding recruit award, her August 1969 performance evaluation was excellent.
3162|3162|1554465P76S1|1554465|1|76|True|False|EvidenceSentence|The Veteran reported, at the November 2002 VA examination, that she enjoyed both active service and reserve service.
3163|3163|1554465P76S2|1554465|2|76|False|False|EvidenceSentence|The Veteran reported that she chose to be discharged from active service in August 1969 due in part to the sexual abuse, but her performance obviously did not deteriorate in any way due to the alleged assault.
3164|3164|1554465P76S3|1554465|3|76|False|False|EvidenceSentence|Importantly, in August 1969, just three months after the alleged sexual assault occurred in May 1969, the Veteran received an excellent performance review.
3165|3165|1554465P77S1|1554465|1|77|True|False|EvidenceSentence|The Veteran enlisted in 1983 for six additional years of reserve service and was promoted.
3166|3166|1554465P77S2|1554465|2|77|False|False|EvidenceSentence|Her reserve component service performance record was also excellent and unblemished.
3167|3167|1554465P77S3|1554465|3|77|False|False|EvidenceSentence|It reflects only high achievement and excellent work ethic.
3168|3168|1554465P77S4|1554465|4|77|False|False|EvidenceSentence|Significantly, VA outpatient treatment records from 2000 and 2001 do not contain any allegation of any kind of military sexual trauma or abuse.
3169|3169|1554465P77S5|1554465|5|77|False|False|EvidenceSentence|The first evidence of a report of military sexual trauma is from August 2002, after the Veteran filed her claim for entitlement to service connection for PTSD.
3170|3170|1554465P77S6|1554465|6|77|False|False|EvidenceSentence|Notably, prior to August 2002, the Veteran specifically alleged other stressors, to include the helicopter crash, seeing dead bodies, and generalized nightmares about people she knew who may have died serving in Vietnam.
3171|3171|1554465P77S7|1554465|7|77|False|False|ReasoningSentence|This is not necessarily significant in and of itself, yet, combined with the other credibility evidence of record; the Board finds that it diminishes her credibility somewhat in that her descriptions regarding her stressors have changed at various examinations.
3172|3172|1554465P78S1|1554465|1|78|True|False|EvidenceSentence|The Veteran was referred to the VA Mental Health Clinic in September 2002 following a positive military sexual trauma and PTSD screening.
3173|3173|1554465P78S2|1554465|2|78|False|False|EvidenceSentence|It was at that time she was diagnosed with PTSD due to the military sexual trauma.
3174|3174|1554465P78S3|1554465|3|78|False|False|EvidenceSentence|In contrast, the VA psychiatrist who conducted November 2002 VA examination, two months later, concluded that the Veteran did not meet the criteria for a diagnosis of PTSD.
3175|3175|1554465P78S4|1554465|4|78|False|False|ReasoningSentence|The Board also points out that the examiner had access to and reviewed the Veteran's claims file, to include her prior psychiatric diagnoses, hallucinations, and alleged stressors.
3176|3176|1554465P78S5|1554465|5|78|False|False|ReasoningSentence|As noted above, the November 2012 VA examination report is lengthy, accurate, and provides the reasoning for the examiner's conclusions.
3177|3177|1554465P78S6|1554465|6|78|False|False|ReasoningSentence|In contrast, the VA psychologist who provided the September 2002 diagnosis did not reference review of any records, but, rather, assigned a diagnosis based upon the Veteran's account of her own history.
3178|3178|1554465P79S1|1554465|1|79|True|False|ReasoningSentence|Also probative regarding the Veteran's credibility is the fact that she has told different examiners different facts regarding her history.
3179|3179|1554465P79S2|1554465|2|79|False|False|EvidenceSentence|At the November 2002 VA exam, she stated that in 1987 approximately she started feeling depressed.
3180|3180|1554465P79S3|1554465|3|79|False|False|EvidenceSentence|At the September 2002 PTSD examination, she stated that she has been having mental health issues ever since service.
3181|3181|1554465P80S1|1554465|1|80|True|False|ReasoningSentence|The various psychiatrists and psychologists who have noted PTSD as due to military sexual trauma appear to have done so based only on the Veteran's self-reported history, rather than review of the complete record.
3182|3182|1554465P80S2|1554465|2|80|False|False|LegalRuleSentence|A medical professional's opinion based on a post-service examination of a veteran is not competent evidence that an in-service stressor occurred.
3183|3183|1554465P80S3|1554465|3|80|False|False|CitationSentence| Cohen v. Brown, 10 Vet. App. 128, 145 (1997); Moreau, 9 Vet. App. 389, 395-96.
3184|3184|1554465P81S1|1554465|1|81|True|False|ReasoningSentence|To the degree that the medical providers have based their opinions on the Veteran's self-reported accounts of military sexual trauma, the Board has found such reports to be not credible, and it follows that medical opinions based on such reports are not probative.
3185|3185|1554465P81S2|1554465|2|81|False|False|ReasoningSentence|Further, because such medical opinions are not based on review of the evidence they do not constitute verification of military sexual trauma under 38 C.F.R. § 3.304(f)(4).
3186|3186|1554465P82S1|1554465|1|82|True|False|ReasoningSentence|As a layperson, the Veteran can certainly provide an account of her symptoms and feelings at any given time.
3187|3187|1554465P82S2|1554465|2|82|False|False|ReasoningSentence|However, service personnel records, and later reserve service records in particular, weigh heavily against the Veteran's September 2002 account that she has had mental health problems ever since her active service.
3188|3188|1554465P82S3|1554465|3|82|False|False|ReasoningSentence|As mentioned previously, the stellar performance evaluation reports during her reserve service generally negate the contention that mental health problems, such as psychosis, were present at that time.
3189|3189|1554465P83S1|1554465|1|83|True|False|EvidenceSentence|In addition, the Veteran has claimed that her PTSD is a result of a stressor involving her witnessing and picking up human remains of Marines who had been killed in a helicopter crash in Camp Pendleton.
3190|3190|1554465P83S2|1554465|2|83|False|False|ReasoningSentence|This stressor is a major event, yet remains unverified after all attempts.
3191|3191|1554465P84S1|1554465|1|84|True|False|Sentence|While the case was on remand status following the 2009 Remand from the Board, the RO was instructed to accomplish all development action in order to corroborate the stressor.
3192|3192|1554465P84S2|1554465|2|84|False|False|EvidenceSentence|The RO acquired a Command Chronology from the Commanding General, Marine Corps Base, Camp Pendleton, California from July 1968 through December 1968; no helicopter crash was reported.
3193|3193|1554465P85S1|1554465|1|85|True|False|EvidenceSentence|"The Veteran then provided statements indicating that, during her reserve service, in 1990, she performed post-crash duties at the site of a helicopter crash in which two female Marines were ""torn to pieces."""
3194|3194|1554465P85S2|1554465|2|85|False|False|ReasoningSentence|No objective confirmation of this stressor has been located.
